Date,Stock,Company,Sector,Close Price,Daily Gain %,Week Gain %,Volume Spike (x avg),RSI (14d),52W High,52W Low,Dist from 52W High %,Sector Weekly Gain %,Market Cap,P/E Ratio,Revenue (Cr),Revenue QoQ %,Revenue YoY %,Net Profit (Cr),Profit QoQ %,Profit YoY %,Operating Profit (Cr),EBITDA Margin %,EPS,EPS Growth YoY %,Operating CF (Cr),Debt to Equity,ROE %,ROCE %,Growth Flags,News (Last 2 Days)
2026-07-23,WAKEFIT.NS,WAKEFIT INNOVATIONS LTD,Consumer Cyclical,153.71,23.89,17.77,12.14,72.5,153.71,113.04,0.0,0.0,50925682688,25.62,N/A,N/A,N/A,N/A,N/A,N/A,N/A,N/A,N/A,N/A,N/A,N/A,N/A,N/A,—,"IPO investors brace for 70 lock-in expiries worth $35 billion in three months. Do you own any?
Unlock Stock Score, Analyst' Ratings & Recommendations
Get multiple analysts' prediction on Wakefit Innovations"
2026-07-23,TANLA.NS,TANLA PLATFORMS LIMITED,Technology,638.05,13.61,8.46,10.21,70.3,638.05,500.65,0.0,-1.07,84333355008,16.78,1177.54,5.04,17.7,134.32,2.25,13.34,200.17,17.0,10.18,15.42,N/A,0.02,21.41,10.8,ROE 21.41%,"Tanla Platforms shares jump nearly 12% on double-digit Q3 FY26 growth
Infosys shares to turn ex-dividend as Oct 26 marks last day to qualify for interim payout
Norges Bank adds multibagger Cartrade Tech, 2 more smallcaps in Rs 209 crore worth bulk deals
Letter To Shareholders For Quarter Ended June 30, 2026.
Unlock Stock Score, Analyst' Ratings & Recommendations"
2026-07-23,JKPAPER.NS,JK PAPER LIMITED,Basic Materials,419.15,11.49,11.83,5.89,87.9,419.15,341.55,0.0,-0.2,75999764480,28.59,1965.95,11.51,20.46,91.98,235.69,40.66,279.07,14.2,5.07,31.35,N/A,0.45,4.78,3.4,Profit +40.66% YoY | Profit +235.69% QoQ | EPS +31.35% YoY,"Vedanta may fall further; M&M, JK Paper are top buys for this week: Anand James
Delhi High Court impleads JK Paper as defendant in the legal dispute over Prithviraj Road bungalow
Board Meeting Intimation for Board Meeting To Be Held On27th July 2026
Unlock Stock Score, Analyst' Ratings & Recommendations
Get multiple analysts' prediction on JK Paper"
2026-07-23,NTPCGREEN.NS,NTPC GREEN ENERGY LIMITED,Utilities,98.37,6.3,5.8,8.65,56.4,104.33,91.97,-5.71,0.0,829319348224,158.74,912.63,39.7,80.69,197.05,1027.29,200.34,822.32,90.1,0.23,187.5,N/A,1.65,2.76,1.62,Revenue +80.69% YoY | Revenue +39.7% QoQ | Profit +200.34% YoY | Profit +1027.29% QoQ | EPS +187.5% YoY | EBITDA Margin 90.1%,"Q1 Results today: Eternal, Nestle, IndusInd Bank among 63 companies announcing June earnings. What to expect?
These large- and mid-cap stocks can give more than 20% return in 1 year, according to analysts
For those who still have patience for long-term investing: 5 large-caps from different sectors with upside potential of up to 30%
Board Meeting Intimation for Board Meeting Intimation For Approval And Consideration Unaudited Financial Results Of The Company For The Quarter Ended On 30Th June 2026.
Get multiple analysts' prediction on NTPC Green Energy"
