Date,Stock,Company,Sector,Close Price,Daily Gain %,Week Gain %,Volume Spike (x avg),RSI (14d),52W High,52W Low,Dist from 52W High %,Sector Weekly Gain %,Market Cap,P/E Ratio,Revenue (Cr),Revenue QoQ %,Revenue YoY %,Net Profit (Cr),Profit QoQ %,Profit YoY %,Operating Profit (Cr),EBITDA Margin %,EPS,EPS Growth YoY %,Operating CF (Cr),Debt to Equity,ROE %,ROCE %,Growth Flags,News (Last 2 Days)
2026-07-23,TANLA.NS,TANLA PLATFORMS LIMITED,Technology,617.4,9.94,4.95,13.48,67.5,617.4,500.65,0.0,-0.54,81577541632,16.23,1177.54,5.04,17.7,134.32,2.25,13.34,200.17,17.0,10.18,15.42,N/A,0.02,21.41,10.8,ROE 21.41%,"Tanla Platforms shares jump nearly 14% post Q1 earnings, revenue surges 17.8% YoY
Letter To Shareholders For Quarter Ended June 30, 2026.
Announcement under Regulation 30 (LODR)-Press Release / Media Release
Announcement under Regulation 30 (LODR)-Investor Presentation
Unlock Stock Score, Analyst' Ratings & Recommendations"
2026-07-23,TIPSMUSIC.NS,TIPS MUSIC LIMITED,Communication Services,677.05,8.7,0.43,9.3,48.8,713.75,622.85,-5.14,0.0,86548381696,39.94,103.93,10.23,33.81,59.06,0.68,33.53,80.7,77.64,4.62,33.53,N/A,0.02,92.33,48.7,Revenue +33.81% YoY | Profit +33.53% YoY | EPS +33.53% YoY | EBITDA Margin 77.64% | ROE 92.33%,No recent news
2026-07-23,LOTUSDEV.NS,SRI LOTUS DEVLPRS N RTY L,Industrials,173.6,6.7,22.97,6.31,72.7,173.6,129.27,0.0,-0.99,84852211712,31.4,307.5,37.26,164.57,95.58,37.03,86.65,135.81,44.17,1.96,87.06,N/A,0.07,17.06,9.77,Revenue +164.57% YoY | Revenue +37.26% QoQ | Profit +86.65% YoY | Profit +37.03% QoQ | EPS +87.06% YoY | EBITDA Margin 44.17%,No recent news
2026-07-23,NTPCGREEN.NS,NTPC GREEN ENERGY LIMITED,Utilities,97.22,6.48,4.48,13.48,55.9,104.33,91.3,-6.81,0.0,819207798784,156.81,912.63,39.7,80.69,197.05,1027.29,200.34,822.32,90.1,0.23,187.5,N/A,1.65,2.76,1.62,Revenue +80.69% YoY | Revenue +39.7% QoQ | Profit +200.34% YoY | Profit +1027.29% QoQ | EPS +187.5% YoY | EBITDA Margin 90.1%,"NTPC Green shares soar 9% after Q1 earnings. What’s boosting investor sentiment?
Board Meeting Intimation for Board Meeting Intimation For Approval And Consideration Unaudited Financial Results Of The Company For The Quarter Ended On 30Th June 2026.
Announcement under Regulation 30 (LODR)-Press Release / Media Release
Get multiple analysts' prediction on NTPC Green Energy"
2026-07-23,THANGAMAYL.NS,THANGAMAYIL JEWELLERY LTD,Consumer Cyclical,6890.0,6.39,8.35,1.51,65.1,6890.0,3794.59,0.0,0.0,214155116544,60.8,2838.21,18.2,150.81,142.66,36.15,196.04,214.4,7.55,45.89,161.33,N/A,0.64,27.93,10.33,Revenue +150.81% YoY | Revenue +18.2% QoQ | Profit +196.04% YoY | Profit +36.15% QoQ | EPS +161.33% YoY | ROE 27.93%,"Bonus, dividends and stock splits: Bharti Airtel, Hero MotoCorp among 88 stocks turning ex-date this week. Do you own any?
Q1 surprise sends jewellery stocks shining 40% in a month. Will the surge last in next quarters?
Silent winners! 43 stocks turned multibaggers even as Nifty went nowhere in 2 years
Board Meeting Intimation for To Approve And Take On Record The Un-Audited Financial Results Of The Company For The Quarter Ended 30Th June, 2026
Unlock Stock Score, Analyst' Ratings & Recommendations"
2026-07-23,TARC.NS,TARC LIMITED,Real Estate,130.4,6.27,10.26,1.85,55.4,133.39,115.4,-2.24,0.0,38480560128,206.98,208.7,443.81,1666.3,1.62,107.71,101.55,1.05,0.5,0.05,101.41,N/A,1.78,1.81,-3.89,Revenue +1666.3% YoY | Revenue +443.81% QoQ | Profit +101.55% YoY | Profit +107.71% QoQ | EPS +101.41% YoY,"India's wealthy are buying multiple luxury homes in the same project
TARC Ltd income jumps to Rs 671.78 crore in FY26, company turns profitable
Unlock Stock Score, Analyst' Ratings & Recommendations
Get multiple analysts' prediction on TARC"
2026-07-23,ROUTE.NS,ROUTE MOBILE LIMITED,Communication Services,600.25,5.85,5.59,16.38,63.3,600.25,504.1,0.0,0.0,37817597952,15.82,1130.9,2.15,-4.47,109.32,11.89,32.54,164.08,14.51,17.35,32.44,N/A,0.01,9.72,7.3,Profit +32.54% YoY | EPS +32.44% YoY,"From red to black: 50 companies turn losses into profit in Q3. Do you own them?
Power Grid shares to approach ex-date for Rs 4.5 per share interim dividend. Last chance to buy
Last day to buy shares of 13 companies to qualify for dividends as Aug 27 record date approaches
Record Date For The Interim Dividend For FY 2026-27, If Declared By The Board In Its Meeting Scheduled On July 23, 2026 Shall Be July 29, 2026.
Unlock Stock Score, Analyst' Ratings & Recommendations"
2026-07-23,UJJIVANSFB.NS,UJJIVAN SMALL FINANC BANK,Financial Services,68.49,5.29,4.37,6.01,73.4,68.49,52.33,0.0,-1.74,133172502528,19.5,1399.59,8.0,32.17,281.97,51.83,159.59,N/A,N/A,1.45,158.93,N/A,N/A,10.74,1.32,Revenue +32.17% YoY | Profit +159.59% YoY | Profit +51.83% QoQ | EPS +158.93% YoY,No recent news
