2026-07-03,UTIAMC.NS,UTI ASSET MNGMT CO LTD,Financial Services,,,,2.05,,987.5,913.95,,-0.2,125485711360,31.12,374.88,-5.03,-0.14,-66.71,-155.15,-144.27,174.46,46.54,-5.19,-143.95,N/A,0.03,9.78,8.92,EBITDA Margin 46.54%,No recent news
2026-07-03,INDUSINDBK.NS,INDUSIND BANK LIMITED,Financial Services,,,,1.74,,949.21,882.52,,-0.2,759147986944,85.32,6085.14,-2.93,-19.75,594.17,364.27,-57.63,N/A,N/A,7.63,-57.63,N/A,N/A,1.36,0.16,Profit +364.27% QoQ,"Highest 1-year FD rates: Where will Rs 5 lakh grow the most in just one year?
Dividends & bonus issues: LIC, Asian Paints among 35 stocks turning ex-record date this week. How many do you own?
IndusInd Bank shares fall 3% after fresh whistleblower complaint reaches PMO, RBI
Intimation Under SEBI (Listing Obligations And Disclosure Requirements) Regulations, 2015
Get multiple analysts' prediction on IndusInd Bank"
2026-07-03,USHAMART.NS,USHA MARTIN LTD.,Basic Materials,,,,1.68,,519.8,454.2,,-4.34,156492185600,31.87,979.26,6.78,13.8,154.89,44.02,67.32,242.65,24.78,4.85,59.54,N/A,0.07,16.23,9.25,Profit +67.32% YoY | Profit +44.02% QoQ | EPS +59.54% YoY,"Vijay Kedia buys 9 lakh shares of SME stock Mahamaya Lifesciences in Rs 12.5 crore block deal
Usha Martin block deal: Promoter entity sells stake worth Rs 99 crore. Morgan Stanley among buyers
These mid-cap stocks with ‘Strong Buy’ & ‘Buy’ recos can rally over 25%, according to analysts
Get multiple analysts' prediction on Usha Martin"
2026-07-03,EPL.NS,EPL LIMITED,Consumer Cyclical,,,,2.62,,238.76,208.34,,0.0,75964997632,19.57,1300.5,13.21,17.65,102.9,25.95,-9.97,265.3,20.4,3.22,-10.06,N/A,0.34,15.08,8.76,Profit +25.95% QoQ,"Q1 earnings preview: Here’s what Nomura expects from Nestle, Titan, other consumer majors’ June quarter results
From roaring crowds to FIFA World Cup absence: What’s holding India back from football’s biggest stage?
Announcement under Regulation 30 (LODR)-Allotment of ESOP / ESPS
Unlock Stock Score, Analyst' Ratings & Recommendations"
2026-07-03,BANKBARODA.NS,BANK OF BARODA,Financial Services,,,,2.7,,286.05,251.81,,-0.2,1304217518080,6.57,19211.96,-1.04,9.23,5800.78,6.57,11.26,N/A,N/A,11.22,11.31,N/A,N/A,12.74,1.01,—,"RBI imposes Rs 66.7 lakh penalty on Bank of Baroda, GIC Housing Finance
Bank of Baroda settles NMC Health dispute for $600 million; Q1 credit grows 17%
UAE central bank restrictions may dampen NRI dollar mobilisation
BoB, Mizuho Bank forge partnership to enhance collaboration in M&A financing
Get multiple analysts' prediction on Bank of Baroda"
