Date,Stock,Company,Sector,Close Price,Daily Gain %,Week Gain %,Volume Spike (x avg),RSI (14d),52W High,52W Low,Dist from 52W High %,Sector Weekly Gain %,Market Cap,P/E Ratio,Revenue (Cr),Revenue QoQ %,Revenue YoY %,Net Profit (Cr),Profit QoQ %,Profit YoY %,Operating Profit (Cr),EBITDA Margin %,EPS,EPS Growth YoY %,Operating CF (Cr),Debt to Equity,ROE %,ROCE %,Growth Flags,News (Last 2 Days)
2026-07-10,NEWGEN.NS,NEWGEN SOFTWARE TECH LTD,Technology,513.55,10.29,6.79,3.69,66.3,518.2,435.9,-0.9,1.99,72541872128,24.21,452.67,13.09,18.78,106.3,69.22,19.43,127.34,28.13,N/A,N/A,N/A,0.02,18.25,10.54,Profit +69.22% QoQ | EBITDA Margin 28.13%,"Ahead of Market: 10 things that will decide stock market action on Wednesday
Ahead of Market: 10 things that will decide D-Street action on Monday
Compliances-Certificate under Reg. 74 (5) of SEBI (DP) Regulations, 2018
Get multiple analysts' prediction on Newgen Software"
2026-07-10,KALYANKJIL.NS,KALYAN JEWELLERS IND LTD,Consumer Cyclical,471.35,6.4,23.37,2.57,74.5,471.35,330.8,0.0,0.0,486782107648,30.49,10274.94,-0.66,66.22,409.5,-1.63,118.28,781.85,7.61,3.97,118.13,N/A,0.97,24.31,7.21,Revenue +66.22% YoY | Profit +118.28% YoY | EPS +118.13% YoY | ROE 24.31%,"Titan Company, Kalyan Jewellers, Senco Gold, other stocks fall up to 2% as Centre tightens duty-free gold imports
Federal Bank, Indian Bank, MCX & Nalco in MSCI Global
Gold, housing plays take a hit as PM Modi's austerity pitch rattles consumer-facing stocks
Get multiple analysts' prediction on Kalyan Jewellers Ind"
2026-07-10,HAPPSTMNDS.NS,HAPPIEST MINDS TECHNO LTD,Technology,385.35,5.4,10.08,1.57,70.7,385.35,336.9,0.0,1.99,57873383424,25.69,604.08,2.81,13.8,61.17,51.79,22.1,121.21,20.07,4.06,21.92,N/A,0.88,13.03,5.64,Profit +51.79% QoQ,No recent news
2026-07-10,MRPL.NS,MRPL,Energy,155.84,5.34,3.89,1.63,52.9,168.95,144.96,-7.76,-0.96,272967254016,14.18,23949.69,-3.08,9.51,116.96,-91.94,-62.19,1445.0,6.03,0.67,-61.93,N/A,1.08,14.17,9.16,—,"ONGC shares fall 4% despite 46% YoY jump in Q4 profit; revenue rises 4%
ONGC Q4 Results: Cons PAT jumps 46% YoY to Rs 10,820 crore, revenue up 4%
Compliances-Certificate under Reg. 74 (5) of SEBI (DP) Regulations, 2018
Announcement under Regulation 30 (LODR)-Change in Management
Get multiple analysts' prediction on MRPL"
2026-07-10,HEG.NS,HEG LTD,Industrials,553.65,5.13,6.07,2.86,61.2,624.6,512.0,-11.36,0.43,106842013696,31.67,603.21,-8.09,12.42,-118.8,-157.4,-72.6,112.46,18.64,-5.9,-54.45,N/A,0.17,7.34,3.3,—,"HEG, Graphite India shares jump up to 14% despite broader market weakness: Here’s why
Siddhartha Bhaiya’s global playbook: Top sectors in US, China and Europe
If not a fund manager, Siddhartha Bhaiya would have been a ""bean counter"". Ace investor's motto, key learnings
Report Of RTA On Re-Lodgment Of Transfer Requests Of Physical Shares For The Month Of June, 2026"
