2026-07-15,INDIAGLYCO.NS,INDIA GLYCOLS LTD,Basic Materials,,,,4.15,,1102.65,934.65,,0.72,76232892416,24.74,976.35,-11.43,13.11,86.88,28.58,35.71,180.1,18.45,13.64,31.91,N/A,0.58,11.28,4.86,Profit +35.71% YoY | Profit +28.58% QoQ | EPS +31.91% YoY,"Ethanol ecosystem: Judging fear by noise is not evidence; 15 stocks from the ecosystem
Unlock Stock Score, Analyst' Ratings & Recommendations
WhiteOak Capital Special Opportunities Direct-G
Motilal Oswal Nifty Microcap 250 Index Direct-G"
2026-07-15,DIVISLAB.NS,DIVI S LABORATORIES LTD,Healthcare,,,,1.87,,7188.5,6521.0,,0.89,1930752950272,74.95,2831.0,8.72,22.08,751.0,28.82,27.5,1089.0,38.47,28.31,27.52,N/A,0.0,16.19,10.07,Profit +28.82% QoQ | EBITDA Margin 38.47%,No recent news
2026-07-15,CHOLAHLDNG.NS,CHOLAMANDALAM FIN HOL LTD,Financial Services,,,,1.55,,1699.3,1412.3,,-1.27,300218613760,12.3,10840.51,3.63,13.87,687.14,9.81,11.99,2070.45,19.1,36.59,11.96,N/A,6.21,18.04,2.22,—,No recent news
