Date,Stock,Company,Sector,Close Price,Daily Gain %,Week Gain %,Volume Spike (x avg),RSI (14d),52W High,52W Low,Dist from 52W High %,Sector Weekly Gain %,Market Cap,P/E Ratio,Revenue (Cr),Revenue QoQ %,Revenue YoY %,Net Profit (Cr),Profit QoQ %,Profit YoY %,Operating Profit (Cr),EBITDA Margin %,EPS,EPS Growth YoY %,Operating CF (Cr),Debt to Equity,ROE %,ROCE %,Growth Flags,News (Last 2 Days)
2026-07-08,THANGAMAYL.NS,THANGAMAYIL JEWELLERY LTD,Consumer Cyclical,6808.5,6.83,14.52,2.35,73.3,6808.5,3546.9,0.0,0.0,211621937152,60.2,2838.21,18.2,150.81,142.66,36.15,196.04,214.4,7.55,45.89,161.33,N/A,0.64,27.93,10.33,Revenue +150.81% YoY | Revenue +18.2% QoQ | Profit +196.04% YoY | Profit +36.15% QoQ | EPS +161.33% YoY | ROE 27.93%,"Jewellery stocks take Rs 60,000 crore hit in 3 days on govt's double-blow. Is the worst behind?
Announcement under Regulation 30 (LODR)-Newspaper Publication
Compliances-Certificate under Reg. 74 (5) of SEBI (DP) Regulations, 2018
Business Responsibility and Sustainability Reporting (BRSR)
Unlock Stock Score, Analyst' Ratings & Recommendations"
2026-07-08,SHAREINDIA.NS,SHARE IND. SECURITIES LTD,Financial Services,175.99,6.72,27.19,10.54,85.7,175.99,126.96,0.0,-2.02,38511108096,9.94,199.46,36.86,66.24,57.83,-34.69,-29.44,121.89,61.11,2.61,-28.69,N/A,0.46,12.97,7.75,Revenue +66.24% YoY | Revenue +36.86% QoQ | EBITDA Margin 61.11%,No recent news
2026-07-08,BALAMINES.NS,BALAJI AMINES LIMITED,Basic Materials,2193.9,6.1,5.48,5.68,49.8,2231.05,1332.9,-1.67,-0.77,71084548096,42.44,394.79,19.16,11.92,63.21,101.09,57.77,101.99,25.83,19.99,61.73,N/A,0.06,8.11,5.3,Revenue +19.16% QoQ | Profit +57.77% YoY | Profit +101.09% QoQ | EPS +61.73% YoY | EBITDA Margin 25.83%,"Dividend Alert! Last day to buy M&M, Swaraj Engines, 31 other stocks to earn payouts up to Rs 110
Higher input costs likely to erode chemical companies' profits
Nykaa, Paytm among six additions in MSCI India index; Tata Elxsi, CONCOR out
Compliances-Certificate under Reg. 74 (5) of SEBI (DP) Regulations, 2018
Unlock Stock Score, Analyst' Ratings & Recommendations"
2026-07-08,KALYANKJIL.NS,KALYAN JEWELLERS IND LTD,Consumer Cyclical,375.4,5.82,-1.48,4.61,45.9,424.55,330.8,-11.58,0.0,387897229312,30.96,10274.94,-0.66,66.22,409.5,-1.63,118.28,781.85,7.61,3.97,118.13,N/A,0.97,24.31,7.21,Revenue +66.22% YoY | Profit +118.28% YoY | EPS +118.13% YoY | ROE 24.31%,"Titan Company, Kalyan Jewellers, Senco Gold, other stocks fall up to 2% as Centre tightens duty-free gold imports
Federal Bank, Indian Bank, MCX & Nalco in MSCI Global
Gold, housing plays take a hit as PM Modi's austerity pitch rattles consumer-facing stocks
Get multiple analysts' prediction on Kalyan Jewellers Ind"
2026-07-08,AEQUS.NS,AEQUS LIMITED,Industrials,255.07,5.21,7.24,3.66,75.6,255.07,175.42,0.0,-1.46,167027097600,N/A,N/A,N/A,N/A,N/A,N/A,N/A,N/A,N/A,N/A,N/A,N/A,N/A,N/A,N/A,—,"Smallcap aerospace stock jumps 17% in two days after earning bullish brokerage calls
This smallcap aerospace stock could soar up to 91%, predicts Nuvama
Aequs shares slide 6% after Q4 swings to loss despite strong revenue growth
Compliances-Certificate under Reg. 74 (5) of SEBI (DP) Regulations, 2018"
