Date,Stock,Company,Sector,Close Price,Daily Gain %,Week Gain %,Volume Spike (x avg),RSI (14d),52W High,52W Low,Dist from 52W High %,Sector Weekly Gain %,Market Cap,P/E Ratio,Revenue (Cr),Revenue QoQ %,Revenue YoY %,Net Profit (Cr),Profit QoQ %,Profit YoY %,Operating Profit (Cr),EBITDA Margin %,EPS,EPS Growth YoY %,Operating CF (Cr),Debt to Equity,ROE %,ROCE %,Growth Flags,News (Last 2 Days)
2026-07-24,GAEL.NS,GUJARAT AMBUJA EXPORTS LT,Consumer Defensive,150.2,7.95,2.95,6.44,34.7,165.35,139.14,-9.16,0.4,68892327936,22.65,1466.51,-1.19,15.78,135.32,105.28,324.2,220.15,15.01,2.95,321.43,N/A,0.13,9.66,5.3,Profit +324.2% YoY | Profit +105.28% QoQ | EPS +321.43% YoY,No recent news
2026-07-24,DBL.NS,DILIP BUILDCON LIMITED,Industrials,411.9,6.49,0.86,18.11,40.0,463.85,386.8,-11.2,-1.59,66911027200,4.78,2299.81,7.57,-25.72,62.05,-92.52,-63.68,453.18,19.7,7.62,-59.73,N/A,1.16,22.89,4.75,ROE 22.89%,"Stocks in news: RIL, Tata Motors, Ola Electric, Dilip Buildcon, Sun Pharma
Shakti Pumps, NCC & KEC International soar up to 16% as govt clears Rs 8.7 lakh crore Jal Jeevan Mission extension
Dilip Buildcon shares rally 4% as lowest bidder for Rs 702 crore Gujarat flood control project
Stocks in news: Maruti Suzuki, Dabur, Info Edge, GR Infraprojects, Dilip Buildcon
Unlock Stock Score, Analyst' Ratings & Recommendations"
2026-07-24,KPITTECH.NS,KPIT TECHNOLOGIES LIMITED,Technology,584.4,6.08,5.48,1.75,60.5,809.25,548.15,-27.78,-1.67,159089606656,25.25,1711.0,5.78,11.95,163.05,22.31,-33.37,328.64,19.21,5.99,-33.52,N/A,0.24,19.73,10.63,Profit +22.31% QoQ,"Explained: Why Tata Elxsi shares crashed 7% after KPIT Tech’s Q1 revenue, profit guidance warning
IT needs selectivity, not blind bargain hunting; Energy, defence and healthcare offer better opportunities: Gurmeet Chadha
Get multiple analysts' prediction on KPIT Tech"
2026-07-24,ACE.NS,ACTION CONST EQUIP LTD,Industrials,1037.2,5.94,5.04,2.63,55.1,1037.2,867.1,0.0,-1.59,123455717376,29.1,785.68,-23.68,-18.24,119.49,7.74,0.78,173.06,22.03,10.04,0.7,N/A,0.0,N/A,N/A,—,No recent news
2026-07-24,PVRINOX.NS,PVR INOX LIMITED,Communication Services,1061.15,5.34,6.19,4.8,60.8,1061.15,943.5,0.0,0.0,104204886016,59.05,1622.2,4.84,31.9,56.5,269.28,146.89,554.7,34.19,5.75,145.17,N/A,0.92,2.44,3.23,Revenue +31.9% YoY | Profit +146.89% YoY | Profit +269.28% QoQ | EPS +145.17% YoY | EBITDA Margin 34.19%,No recent news
